[
    {
        "name": "Skylark North America",
        "description": "Skylark service in North America",
        "urls": [
            "http://na.l1l2.skylark.swiftnav.com:2101",
            "http://na.l1l5.skylark.swiftnav.com:2101",
            "http://na.all-freq.skylark.swiftnav.com:2101",
            "https://na.l1l2.skylark.swiftnav.com:2102",
            "https://na.l1l5.skylark.swiftnav.com:2102",
            "https://na.all-freq.skylark.swiftnav.com:2102"
        ],
        "reference": {
            "url": "https://support.swiftnav.com/support/solutions/articles/44002519397-ntrip-client-configuration-for-skylark-corrections"
        },
        "last_update": "2025-04-15",
        "streams": [
            {
                "filter": {
                    "mountpoints": [
                        "NXRTK-NAD83-MSM5"
                    ]
                },
                "crss": [
                    {
                        "id": "EPSG:6319",
                        "name": "NAD83(2011)"
                    }
                ],
                "comments": "Skylark Nx RTK mountpoint available in contiguous United States only"
            },
            {
                "filter": {
                    "mountpoints": [
                        "MSM4",
                        "MSM5",
                        "OSR",
                        "SSR",
                        "SSR-integrity",
                        "SSR-integrity-AES-CMAC"
                    ]
                },
                "crss": [
                    {
                        "id": "EPSG:9989",
                        "name": "ITRF2020"
                    }
                ],
                "comments": "Skylark Cx mountpoints ITRF2020"
            },
            {
                "filter": {
                    "mountpoints": [
                        "DX-MSM1"
                    ]
                },
                "crss": [
                    {
                        "id": "EPSG:9989",
                        "name": "ITRF2020"
                    }
                ],
                "comments": "Skylark Dx mountpoints ITRF2020"
            },
            {
                "filter": {
                    "mountpoints": [
                        "NXRTK-MSM5",
                        "NXRTK-RTCM31"
                    ]
                },
                "crss": [
                    {
                        "id": "EPSG:9989",
                        "name": "ITRF2020"
                    }
                ],
                "comments": "Skylark Nx RTK mountpoints ITRF2020"
            }
        ]
    }
]
